{
  "$schema": "https://json-schema.org/draft/2020-12/schema",
  "$id": "https://meta.audiosilo.app/schema/work.schema.json",
  "title": "work",
  "description": "An abstract book: title, authors, series membership. Narrations live in sibling recording records.",
  "type": "object",
  "additionalProperties": false,
  "required": ["id", "title", "authors", "language", "license", "sources"],
  "properties": {
    "id": {
      "$ref": "common.schema.json#/$defs/slug"
    },
    "title": {
      "type": "string",
      "minLength": 1
    },
    "subtitle": {
      "type": "string",
      "minLength": 1
    },
    "authors": {
      "description": "The work's authors as person slugs. The slug is the identity, so the list may not repeat one.",
      "type": "array",
      "minItems": 1,
      "uniqueItems": true,
      "items": {
        "$ref": "common.schema.json#/$defs/slug"
      }
    },
    "credits": {
      "description": "Contributors credited in a role that is not authorship: translator, editor, illustrator and the rest of the controlled vocabulary. Optional and purely additive - authors stays the identity list, and a person credited here is NOT removed from it when a source names them as both. Omitted unless a source STATED the role; never inferred.",
      "$ref": "common.schema.json#/$defs/credit_list"
    },
    "language": {
      "$ref": "common.schema.json#/$defs/language"
    },
    "first_published": {
      "$ref": "common.schema.json#/$defs/date_year"
    },
    "description": {
      "type": "string"
    },
    "genres": {
      "description": "The work's genres, drawn from this project's own normalized vocabulary (never a retailer's taxonomy). Optional: omit it rather than guess.",
      "$ref": "common.schema.json#/$defs/genre_list"
    },
    "translation_of": {
      "description": "A directed link from a TRANSLATION to the work or works it translates (the original). Stated evidence only, never inferred. An array so a translated omnibus of two originals is expressible; almost always one element.",
      "$ref": "common.schema.json#/$defs/slug_set"
    },
    "xref": {
      "type": "object",
      "additionalProperties": false,
      "properties": {
        "wikidata": {
          "type": "string",
          "pattern": "^Q\\d+$"
        },
        "openlibrary": {
          "type": "string",
          "pattern": "^OL\\d+W$"
        },
        "goodreads": {
          "type": "string",
          "minLength": 1
        },
        "isbn": {
          "$ref": "common.schema.json#/$defs/isbn_list"
        }
      }
    },
    "added_at": {
      "description": "When this work entered the database. Stamped at creation by the importer and the intake bot as a plain date; records dated by the one-time git-history backfill carry that commit's full timestamp verbatim. Optional, since records predating the field carry none.",
      "$ref": "common.schema.json#/$defs/date_or_datetime"
    },
    "recordings": {
      "description": "The work's recordings, keyed by recording slug. Present only in a works-family pack entry, where the map key replaces the recording's filename; a standalone work record never carries it.",
      "type": "object",
      "propertyNames": {
        "$ref": "common.schema.json#/$defs/slug"
      },
      "additionalProperties": {
        "$ref": "recording.schema.json"
      }
    },
    "license": {
      "$ref": "common.schema.json#/$defs/license"
    },
    "sources": {
      "$ref": "common.schema.json#/$defs/sources"
    }
  }
}
