{
  "authors": [
    "k-f-breene"
  ],
  "genres": [
    "paranormal",
    "romance"
  ],
  "id": "raised-in-fire-dramatized-adaptation",
  "language": "en",
  "license": "CC0-1.0",
  "sources": [
    {
      "imported_at": "2026-07-25",
      "ref": "B0BQ4YV56R",
      "type": "audiosilo-books-import"
    },
    {
      "imported_at": "2026-07-30",
      "ref": "B0BQ4YV56R",
      "type": "libex-import"
    }
  ],
  "title": "Raised in Fire [Dramatized Adaptation]"
}
