{
  "authors": [
    "j-m-barrie"
  ],
  "genres": [
    "classics"
  ],
  "id": "the-little-white-bird",
  "language": "en",
  "license": "CC0-1.0",
  "sources": [
    {
      "imported_at": "2026-07-30",
      "ref": "B07W36ZJSP",
      "type": "libex-import"
    }
  ],
  "title": "The Little White Bird"
}
