{
  "authors": [
    "gertrude-chandler-warner"
  ],
  "genres": [
    "action-adventure",
    "childrens",
    "mystery",
    "nature"
  ],
  "id": "the-dinosaur-mystery",
  "language": "en",
  "license": "CC0-1.0",
  "sources": [
    {
      "imported_at": "2026-07-25",
      "ref": "B00QSH65TE",
      "type": "audiosilo-books-import"
    },
    {
      "imported_at": "2026-07-30",
      "ref": "B00QSH65TE",
      "type": "libex-import"
    }
  ],
  "title": "The Dinosaur Mystery"
}
