{
  "authors": [
    "kami-garcia"
  ],
  "id": "dream-dark",
  "language": "en",
  "license": "CC0-1.0",
  "sources": [
    {
      "imported_at": "2026-07-25",
      "ref": "https://www.goodreads.com/book/show/11568316-dream-dark",
      "type": "community"
    }
  ],
  "title": "Dream Dark",
  "xref": {
    "goodreads": "11568316"
  }
}
