{
  "authors": [
    "lara-adrian"
  ],
  "id": "the-midnight-breed-series-companion",
  "language": "en",
  "license": "CC0-1.0",
  "sources": [
    {
      "imported_at": "2026-07-25",
      "ref": "https://www.goodreads.com/book/show/17908520-the-midnight-breed-series-companion",
      "type": "community"
    }
  ],
  "title": "The Midnight Breed Series Companion",
  "xref": {
    "goodreads": "17908520"
  }
}
