{
  "authors": [
    "maggie-tokuda-hall"
  ],
  "genres": [
    "action-adventure",
    "fantasy",
    "historical-fiction",
    "lgbtq",
    "young-adult"
  ],
  "id": "the-siren-the-song-and-the-spy",
  "language": "en",
  "license": "CC0-1.0",
  "sources": [
    {
      "imported_at": "2026-07-17",
      "ref": "B0CDJG7JP8",
      "type": "audiosilo-books-import"
    },
    {
      "imported_at": "2026-07-30",
      "ref": "B0CDJG7JP8",
      "type": "libex-import"
    }
  ],
  "title": "The Siren, the Song, and the Spy"
}
