{
  "authors": [
    "debbie-dadey",
    "marcia-thornton-jones"
  ],
  "genres": [
    "childrens",
    "fantasy",
    "mystery"
  ],
  "id": "vampires-dont-wear-polka-dots",
  "language": "en",
  "license": "CC0-1.0",
  "sources": [
    {
      "imported_at": "2026-07-25",
      "ref": "170526932X",
      "type": "audiosilo-books-import"
    },
    {
      "imported_at": "2026-07-30",
      "ref": "170526932X",
      "type": "libex-import"
    }
  ],
  "title": "Vampires Don't Wear Polka Dots"
}
