{
  "authors": [
    "scott-sigler",
    "matt-wallace"
  ],
  "genres": [
    "action-adventure",
    "mystery",
    "science-fiction"
  ],
  "id": "the-detective",
  "language": "en",
  "license": "CC0-1.0",
  "sources": [
    {
      "imported_at": "2026-07-30",
      "ref": "B019QMFNWM",
      "type": "libex-import"
    }
  ],
  "title": "The Detective"
}
