{
  "authors": [
    "t-h-white"
  ],
  "genres": [
    "fantasy",
    "literary-fiction",
    "young-adult"
  ],
  "id": "the-once-and-future-king",
  "language": "en",
  "license": "CC0-1.0",
  "sources": [
    {
      "imported_at": "2026-07-25",
      "ref": "B00546D584",
      "type": "audiosilo-books-import"
    },
    {
      "imported_at": "2026-07-30",
      "ref": "B00546D584",
      "type": "libex-import"
    }
  ],
  "title": "The Once and Future King"
}
