{
  "authors": [
    "r-l-stine"
  ],
  "id": "classic-goosebumps-the-curse-of-the-mummys-tomb",
  "language": "en",
  "license": "CC0-1.0",
  "sources": [
    {
      "imported_at": "2026-07-25",
      "ref": "B00U29VBDO",
      "type": "audiosilo-books-import"
    }
  ],
  "title": "Classic Goosebumps: The Curse of the Mummy's Tomb"
}
