{
  "authors": [
    "james-s-a-corey"
  ],
  "genres": [
    "action-adventure",
    "science-fiction",
    "short-stories",
    "space-opera"
  ],
  "id": "the-butcher-of-anderson-station",
  "language": "en",
  "license": "CC0-1.0",
  "sources": [
    {
      "imported_at": "2026-07-30",
      "ref": "B09MZMQ232",
      "type": "libex-import"
    }
  ],
  "title": "The Butcher of Anderson Station"
}
