{
  "authors": [
    "kerstin-gier"
  ],
  "id": "smaragdgrun",
  "language": "en",
  "license": "CC0-1.0",
  "sources": [
    {
      "imported_at": "2026-07-25",
      "ref": "https://www.goodreads.com/book/show/7544603-smaragdgr-n",
      "type": "community"
    }
  ],
  "title": "Smaragdgrün",
  "xref": {
    "goodreads": "7544603"
  }
}
