{
  "authors": [
    "fyodor-dostoevsky",
    "david-mcduff"
  ],
  "genres": [
    "classics",
    "parenting-relationships",
    "psychological-thriller"
  ],
  "id": "the-brothers-karamazov",
  "language": "en",
  "license": "CC0-1.0",
  "sources": [
    {
      "imported_at": "2026-07-17",
      "ref": "0241533228",
      "type": "audiosilo-books-import"
    },
    {
      "imported_at": "2026-07-30",
      "ref": "0241533228",
      "type": "libex-import"
    }
  ],
  "title": "The Brothers Karamazov"
}
