{
  "authors": [
    "barbara-park"
  ],
  "genres": [
    "childrens",
    "comedy-humor",
    "coming-of-age",
    "self-help"
  ],
  "id": "junie-b-jones-audio-collection-books-17-24",
  "language": "en",
  "license": "CC0-1.0",
  "sources": [
    {
      "imported_at": "2026-07-30",
      "ref": "B0FPZQ43FG",
      "type": "libex-import"
    }
  ],
  "title": "Junie B. Jones Audio Collection: Books 17-24"
}
