{
  "authors": [
    "robert-kolker"
  ],
  "genres": [
    "biography-memoir",
    "parenting-relationships",
    "true-crime"
  ],
  "id": "lost-girls",
  "language": "en",
  "license": "CC0-1.0",
  "sources": [
    {
      "imported_at": "2026-07-17",
      "ref": "B00D97UM68",
      "type": "audiosilo-books-import"
    },
    {
      "imported_at": "2026-07-30",
      "ref": "B00D97UM68",
      "type": "libex-import"
    }
  ],
  "title": "Lost Girls"
}
