{
  "authors": [
    "mary-pope-osborne"
  ],
  "genres": [
    "action-adventure",
    "childrens",
    "fantasy",
    "historical-fiction",
    "nature"
  ],
  "id": "time-of-the-turtle-king",
  "language": "en",
  "license": "CC0-1.0",
  "sources": [
    {
      "imported_at": "2026-07-25",
      "ref": "B0BT8N5BLG",
      "type": "audiosilo-books-import"
    },
    {
      "imported_at": "2026-07-30",
      "ref": "B0BT8N5BLG",
      "type": "libex-import"
    }
  ],
  "title": "Time of the Turtle King"
}
