{
  "authors": [
    "michael-sisa"
  ],
  "id": "legend-of-the-arch-magus-publishers-pack-5",
  "language": "en",
  "license": "CC0-1.0",
  "sources": [
    {
      "imported_at": "2026-07-11",
      "ref": "B0BVDPRL8G",
      "type": "openaudible-import"
    }
  ],
  "title": "Legend of the Arch Magus: Publisher's Pack 5"
}
