{
  "authors": [
    "l-m-montgomery"
  ],
  "id": "the-anne-of-green-gables-collection",
  "language": "en",
  "license": "CC0-1.0",
  "sources": [
    {
      "imported_at": "2026-07-30",
      "ref": "1974921832",
      "type": "libex-import"
    }
  ],
  "title": "The Anne of Green Gables Collection"
}
