{
  "authors": [
    "alastair-reynolds"
  ],
  "genres": [
    "action-adventure",
    "hard-science-fiction",
    "literary-fiction",
    "science-fiction",
    "space-opera"
  ],
  "id": "on-the-steel-breeze",
  "language": "en",
  "license": "CC0-1.0",
  "sources": [
    {
      "imported_at": "2026-07-25",
      "ref": "B00JMPC4SU",
      "type": "audiosilo-books-import"
    },
    {
      "imported_at": "2026-07-30",
      "ref": "B00JMPC4SU",
      "type": "libex-import"
    }
  ],
  "title": "On the Steel Breeze"
}
