{
  "authors": [
    "richelle-mead"
  ],
  "id": "last-sacrifice",
  "language": "en",
  "license": "CC0-1.0",
  "sources": [
    {
      "imported_at": "2026-07-25",
      "ref": "https://www.goodreads.com/book/show/6527740-last-sacrifice",
      "type": "community"
    }
  ],
  "title": "Last Sacrifice",
  "xref": {
    "goodreads": "6527740"
  }
}
