{
  "authors": [
    "gertrude-chandler-warner"
  ],
  "genres": [
    "action-adventure",
    "childrens",
    "coming-of-age",
    "horror",
    "mystery",
    "parenting-relationships"
  ],
  "id": "the-sleepy-hollow-mystery",
  "language": "en",
  "license": "CC0-1.0",
  "sources": [
    {
      "imported_at": "2026-07-30",
      "ref": "B01IIU3PDW",
      "type": "libex-import"
    }
  ],
  "title": "The Sleepy Hollow Mystery"
}
