{
  "authors": [
    "sherrilyn-kenyon"
  ],
  "id": "night-embrace",
  "language": "en",
  "license": "CC0-1.0",
  "sources": [
    {
      "imported_at": "2026-07-25",
      "ref": "https://www.goodreads.com/book/show/6567284-night-embrace",
      "type": "community"
    }
  ],
  "title": "Night Embrace",
  "xref": {
    "goodreads": "6567284"
  }
}
