{
  "authors": [
    "diana-gabaldon"
  ],
  "genres": [
    "historical-fiction",
    "mystery"
  ],
  "id": "lord-john-and-the-hellfire-club",
  "language": "en",
  "license": "CC0-1.0",
  "sources": [
    {
      "imported_at": "2026-07-30",
      "ref": "B002V0QNPI",
      "type": "libex-import"
    }
  ],
  "title": "Lord John and the Hellfire Club"
}
