{
  "authors": [
    "j-r-r-tolkien"
  ],
  "genres": [
    "fantasy"
  ],
  "id": "the-hobbit",
  "language": "en",
  "license": "CC0-1.0",
  "sources": [
    {
      "imported_at": "2026-07-11",
      "ref": "0008433844",
      "type": "openaudible-import"
    },
    {
      "imported_at": "2026-07-30",
      "ref": "B0030EJV3U",
      "type": "libex-import"
    }
  ],
  "title": "The Hobbit"
}
